{
  "$schema": "../../../level.schema.json",
  "version": 1,
  "name": {
    "en": "Deep Water",
    "de": "Tiefes Wasser"
  },
  "size": [8, 7],
  "objects": [
    {
      "type": "laser",
      "pos": "B4",
      "rot": 6,
      "rgb": "rgb"
    },
    {
      "type": "coin",
      "pos": "C3",
      "rgb": "rgb"
    },
    {
      "type": "coin",
      "pos": "E3",
      "rgb": "gb"
    },
    {
      "type": "coin",
      "pos": "F3",
      "rgb": "gb"
    },
    {
      "type": "coin",
      "pos": "G1",
      "rgb": "rb"
    }
  ],
  "toolbox": [
    {
      "type": "polarizer",
      "rot": 0,
      "rgb": "gb"
    },
    {
      "type": "colorConverter",
      "rot": 0
    },
    {
      "type": "mirror",
      "rot": 0,
      "count": 2
    }
  ],
  "solution": [
    {
      "piece": 2,
      "pos": "B3",
      "rot": 3
    },
    {
      "piece": 0,
      "pos": "D3",
      "rot": 4
    },
    {
      "piece": 3,
      "pos": "G3",
      "rot": 7
    },
    {
      "piece": 1,
      "pos": "G2",
      "rot": 2
    }
  ]
}
