{
  "$schema": "../../../level.schema.json",
  "version": 1,
  "name": {
    "en": "Purple Tide",
    "de": "Violette Flut"
  },
  "size": [8, 7],
  "objects": [
    {
      "type": "laser",
      "pos": "A1",
      "rot": 2,
      "rgb": "r"
    },
    {
      "type": "coin",
      "pos": "A2",
      "rgb": "rb"
    },
    {
      "type": "laser",
      "pos": "B4",
      "rot": 2,
      "rgb": "b"
    },
    {
      "type": "coin",
      "pos": "C5",
      "rgb": "r"
    },
    {
      "type": "coin",
      "pos": "E6",
      "rgb": "r"
    }
  ],
  "toolbox": [
    {
      "type": "prism",
      "rot": 0
    },
    {
      "type": "mirror",
      "rot": 0,
      "count": 2
    }
  ],
  "solution": [
    {
      "piece": 1,
      "pos": "A5",
      "rot": 5
    },
    {
      "piece": 0,
      "pos": "B5",
      "rot": 4
    },
    {
      "piece": 2,
      "pos": "E5",
      "rot": 1
    }
  ]
}
