{
  "$schema": "../../../level.schema.json",
  "version": 1,
  "name": { "en": "Mixing Desk", "de": "Mischpult" },
  "note": "The prism the other way round: red from the east, green from the south-east and blue from the south join into white.",
  "size": [6, 5],
  "objects": [
    { "type": "laser", "pos": "A6", "rot": 4, "rgb": "r" },
    { "type": "coin", "pos": "C1", "rgb": "rgb" },
    { "type": "laser", "pos": "E1", "rot": 2, "rgb": "b" },
    { "type": "laser", "pos": "E5", "rot": 7, "rgb": "g" }
  ],
  "toolbox": [{ "type": "prism", "rot": 0 }, { "type": "mirror", "rot": 0, "count": 2 }],
  "solution": [
    { "piece": 0, "pos": "C3", "rot": 2 },
    { "piece": 1, "pos": "C6", "rot": 7 },
    { "piece": 2, "pos": "E3", "rot": 7 }
  ]
}
