{
  "$schema": "../../../level.schema.json",
  "version": 1,
  "name": { "en": "Diagonal Pass", "de": "Schrägpass" },
  "note": "The refractor in E2 sends blue up the diagonal. The slit mirror in C4 turns red north to A4 and lets blue slip through its slit to A6.",
  "size": [6, 5],
  "objects": [
    { "type": "coin", "pos": "A4", "rgb": "r" },
    { "type": "coin", "pos": "A6", "rgb": "b" },
    { "type": "laser", "pos": "C1", "rot": 2, "rgb": "r" },
    { "type": "coin", "pos": "C2", "rgb": "r" },
    { "type": "laser", "pos": "E1", "rot": 2, "rgb": "b" }
  ],
  "toolbox": [{ "type": "refractor", "rot": 0 }, { "type": "slitMirror", "rot": 0 }],
  "solution": [{ "piece": 0, "pos": "E2", "rot": 2 }, { "piece": 1, "pos": "C4", "rot": 3 }]
}
