{
  "$schema": "../../../level.schema.json",
  "version": 1,
  "name": {
    "en": "Fork in the Road",
    "de": "Gabelung"
  },
  "size": [7, 6],
  "objects": [
    {
      "type": "coin",
      "pos": "C1",
      "rgb": "g"
    },
    {
      "type": "laser",
      "pos": "D3",
      "rot": 6,
      "rgb": "g"
    },
    {
      "type": "coin",
      "pos": "F2",
      "rgb": "g"
    }
  ],
  "toolbox": [
    {
      "type": "threeway",
      "rot": 0
    },
    {
      "type": "mirror",
      "rot": 0
    }
  ],
  "solution": [
    {
      "piece": 0,
      "pos": "D2",
      "rot": 6
    },
    {
      "piece": 1,
      "pos": "E1",
      "rot": 2
    }
  ]
}
