{
  "$schema": "../../../level.schema.json",
  "version": 1,
  "name": { "en": "Polarized", "de": "Polarisiert" },
  "note": "Only blue traveling east may cross B3: the polarizer filters by color and direction at once.",
  "size": [5, 3],
  "objects": [
    { "type": "antiCoin", "pos": "A3" },
    { "type": "laser", "pos": "B1", "rot": 2, "rgb": "rgb" },
    { "type": "coin", "pos": "B5", "rgb": "b" },
    { "type": "laser", "pos": "C3", "rot": 0, "rgb": "r" }
  ],
  "toolbox": [{ "type": "polarizer", "rot": 0, "rgb": "b" }],
  "solution": [{ "piece": 0, "pos": "B3", "rot": 2 }]
}
